cveid,year,hash,desc,link,publishedDate1950,2013,b61ac518ffa2657e2dc9019b2dcf2f3f37dbfab0,"moxieplayer.as in Moxiecode moxieplayer, as used in the TinyMCE Media plugin in WordPress before 3.5.2 and other products, does not consider the presence of a # (pound sign) character during extraction of the QUERY_STRING, which allows remote attackers to pass arbitrary parameters to a Flash application, and conduct content-spoofing attacks, via a crafted string after a ? (question mark) character.",http://github.com/moxiecode/moxieplayer/commit/b61ac518ffa2657e2dc9019b2dcf2f3f37dbfab0,2013-07-08T20:55Z
1952,2013,f2815633504b442ca0b0605c16bf3d88a3a0fcea,"The sctp_sf_do_5_2_4_dupcook function in net/sctp/sm_statefuns.c in the SCTP implementation in the Linux kernel before 3.8.5 does not properly handle associations during the processing of a duplicate COOKIE ECHO chunk, which allows remote attackers to cause a denial of service (NULL pointer dereference and system crash) or possibly have unspecified other impact via crafted SCTP traffic.",http://github.com/torvalds/linux/commit/f2815633504b442ca0b0605c16bf3d88a3a0fcea,2013-07-04T21:55Z
1955,2013,4aaacbb1e628a80803ba1a55703db38fccdf7dbf,Cross-site scripting (XSS) vulnerability in the auto-complete widget in htdocs/media/rb/js/reviews.js in Review Board 1.6.x before 1.6.17 and 1.7.x before 1.7.10 allows remote attackers to inject arbitrary web script or HTML via a full name.,http://github.com/reviewboard/reviewboard/commit/4aaacbb1e628a80803ba1a55703db38fccdf7dbf,2013-07-31T13:20Z
1964,2013,13c149b051f82b709e8d7cc32111e84b49d57234,Buffer overflow in the radius_get_vendor_attr function in the Radius extension before 1.2.7 for PHP allows remote attackers to cause a denial of service (crash) and possibly execute arbitrary code via a large Vendor Specific Attributes (VSA) length value.,http://github.com/LawnGnome/php-radius/commit/13c149b051f82b709e8d7cc32111e84b49d57234,2013-07-31T13:20Z
1965,2013,4654f330317c9948bb61d138eb24d49690ca4637,Heap-based buffer overflow in the ZRtp::storeMsgTemp function in GNU ZRTPCPP before 3.2.0 allows remote attackers to cause a denial of service (crash) and possibly execute arbitrary code via a large packet.,http://github.com/wernerd/ZRTPCPP/commit/4654f330317c9948bb61d138eb24d49690ca4637,2013-10-04T17:55Z
1966,2013,4654f330317c9948bb61d138eb24d49690ca4637,"Multiple stack-based buffer overflows in GNU ZRTPCPP before 3.2.0 allow remote attackers to cause a denial of service (crash) and possibly execute arbitrary code via a crafted ZRTP Hello packet to the (1) ZRtp::findBestSASType, (2) ZRtp::findBestAuthLen, (3) ZRtp::findBestCipher, (4) ZRtp::findBestHash, or (5) ZRtp::findBestPubKey functions.",http://github.com/wernerd/ZRTPCPP/commit/4654f330317c9948bb61d138eb24d49690ca4637,2013-10-04T17:55Z
1967,2013,4654f330317c9948bb61d138eb24d49690ca4637,"GNU ZRTPCPP before 3.2.0 allows remote attackers to obtain sensitive information (uninitialized heap memory) or cause a denial of service (out-of-bounds read) via a crafted packet, as demonstrated by a truncated Ping packet that is not properly handled by the getEpHash function.",http://github.com/wernerd/ZRTPCPP/commit/4654f330317c9948bb61d138eb24d49690ca4637,2013-10-04T17:55Z
1974,2013,a963a37d384d71ad43b3e9e79d68d42fbe0901f3,The ip6_sk_dst_check function in net/ipv6/ip6_output.c in the Linux kernel before 3.10 allows local users to cause a denial of service (system crash) by using an AF_INET6 socket for a connection to an IPv4 interface.,http://github.com/torvalds/linux/commit/a963a37d384d71ad43b3e9e79d68d42fbe0901f3,2013-07-04T21:55Z
1976,2013,a5cc68f3d63306d0d288f31edfc2ae6ef8ecd887,"The (1) key_notify_sa_flush and (2) key_notify_policy_flush functions in net/key/af_key.c in the Linux kernel before 3.10 do not initialize certain structure members, which allows local users to obtain sensitive information from kernel heap memory by reading a broadcast message from the notify interface of an IPSec key_socket.",http://github.com/torvalds/linux/commit/a5cc68f3d63306d0d288f31edfc2ae6ef8ecd887,2013-07-04T21:55Z
1978,2013,85dfb745ee40232876663ae206cba35f24ab2a40,"The key_notify_policy_flush function in net/key/af_key.c in the Linux kernel before 3.9 does not initialize a certain structure member, which allows local users to obtain sensitive information from kernel heap memory by reading a broadcast message from the notify_policy interface of an IPSec key_socket.",http://github.com/torvalds/linux/commit/85dfb745ee40232876663ae206cba35f24ab2a40,2013-07-04T21:55Z
1981,2013,c5318bb1a2dd266b50317a2adb74d74338593733,"lib/flowplayer.swf.php in Gallery 3 before 3.0.9 does not properly remove query fragments, which allows remote attackers to have an unspecified impact via a replay attack, a different vulnerability than CVE-2013-2138.",http://github.com/gallery/gallery3/commit/c5318bb1a2dd266b50317a2adb74d74338593733,2013-10-10T00:55Z
1982,2013,cbbcf1b4791762d7da0ea7b6c4f4b551a4d9caed,"modules/gallery/helpers/data_rest.php in Gallery 3 before 3.0.9 allows remote attackers to bypass intended access restrictions and obtain sensitive information (image files) via the ""full"" string in the size parameter.",http://github.com/gallery/gallery3/commit/cbbcf1b4791762d7da0ea7b6c4f4b551a4d9caed,2013-10-10T00:55Z
2215,2013,038d74771d3b5c13d13b738b73dfda1033a99f65,"app/models/spree/user.rb in spree_auth_devise in Spree 1.1.x before 1.1.6, 1.2.x, and 1.3.x does not perform mass assignment safely when updating a user, which allows remote authenticated users to assign arbitrary roles to themselves.",http://github.com/spree/spree_auth_devise/commit/038d74771d3b5c13d13b738b73dfda1033a99f65,2013-03-08T18:55Z
2220,2013,9a5467bf7b6e9e02ec9c3da4e23747c05faeaac6,"The report API in the crypto user configuration API in the Linux kernel through 3.8.2 uses an incorrect C library function for copying strings, which allows local users to obtain sensitive information from kernel stack memory by leveraging the CAP_NET_ADMIN capability.",http://github.com/torvalds/linux/commit/9a5467bf7b6e9e02ec9c3da4e23747c05faeaac6,2013-03-15T20:55Z
2221,2013,9a5467bf7b6e9e02ec9c3da4e23747c05faeaac6,"The crypto_report_one function in crypto/crypto_user.c in the report API in the crypto user configuration API in the Linux kernel through 3.8.2 does not initialize certain structure members, which allows local users to obtain sensitive information from kernel heap memory by leveraging the CAP_NET_ADMIN capability.",http://github.com/torvalds/linux/commit/9a5467bf7b6e9e02ec9c3da4e23747c05faeaac6,2013-03-15T20:55Z
2222,2013,9a5467bf7b6e9e02ec9c3da4e23747c05faeaac6,"The crypto_report_one function in crypto/crypto_user.c in the report API in the crypto user configuration API in the Linux kernel through 3.8.2 uses an incorrect length value during a copy operation, which allows local users to obtain sensitive information from kernel memory by leveraging the CAP_NET_ADMIN capability.",http://github.com/torvalds/linux/commit/9a5467bf7b6e9e02ec9c3da4e23747c05faeaac6,2013-03-15T20:55Z
2233,2013,6c8aa4e9c810994f7632837487426867ce50f468,SQL injection vulnerability in Symphony CMS before 2.3.2 allows remote authenticated users to execute arbitrary SQL commands via the sort parameter to system/authors/.  NOTE: this can be leveraged using CSRF to allow remote unauthenticated attackers to execute arbitrary SQL commands.,http://github.com/symphonycms/symphony-2/commit/6c8aa4e9c810994f7632837487426867ce50f468,2014-03-27T16:55Z
2253,2013,b4cbb197c7e7a68dbad0d491242e3ca67420c13e,"Integer overflow in the fb_mmap function in drivers/video/fbmem.c in the Linux kernel before 3.8.9, as used in a certain Motorola build of Android 4.1.2 and other products, allows local users to create a read-write memory mapping for the entirety of kernel memory, and consequently gain privileges, via crafted /dev/graphics/fb0 mmap2 system calls, as demonstrated by the Motochopper pwn program.",http://github.com/torvalds/linux/commit/b4cbb197c7e7a68dbad0d491242e3ca67420c13e,2013-04-13T02:59Z
2253,2013,fc9bbca8f650e5f738af8806317c0a041a48ae4a,"Integer overflow in the fb_mmap function in drivers/video/fbmem.c in the Linux kernel before 3.8.9, as used in a certain Motorola build of Android 4.1.2 and other products, allows local users to create a read-write memory mapping for the entirety of kernel memory, and consequently gain privileges, via crafted /dev/graphics/fb0 mmap2 system calls, as demonstrated by the Motochopper pwn program.",http://github.com/torvalds/linux/commit/fc9bbca8f650e5f738af8806317c0a041a48ae4a,2013-04-13T02:59Z
2272,2013,29cd8ae0e1a39e239a3a7b67da1986add1199fc0,"net/dcb/dcbnl.c in the Linux kernel before 3.8.4 does not initialize certain structures, which allows local users to obtain sensitive information from kernel stack memory via a crafted application.",http://github.com/torvalds/linux/commit/29cd8ae0e1a39e239a3a7b67da1986add1199fc0,2013-03-22T11:59Z
2273,2013,84d73cd3fb142bf1298a8c13fd4ca50fd2432372,"The rtnl_fill_ifinfo function in net/core/rtnetlink.c in the Linux kernel before 3.8.4 does not initialize a certain structure member, which allows local users to obtain sensitive information from kernel stack memory via a crafted application.",http://github.com/torvalds/linux/commit/84d73cd3fb142bf1298a8c13fd4ca50fd2432372,2013-03-22T11:59Z
2274,2013,c085c49920b2f900ba716b4ca1c1a55ece9872cc,"net/bridge/br_mdb.c in the Linux kernel before 3.8.4 does not initialize certain structures, which allows local users to obtain sensitive information from kernel memory via a crafted application.",http://github.com/torvalds/linux/commit/c085c49920b2f900ba716b4ca1c1a55ece9872cc,2013-03-22T11:59Z
2284,2013,3e88c98ca513880e2b43ed7f27ade17fef5d9170,"security/MemberLoginForm.php in SilverStripe 3.0.3 supports login using a GET request, which makes it easier for remote attackers to conduct phishing attacks without detection by the victim.",http://github.com/chillu/silverstripe-framework/commit/3e88c98ca513880e2b43ed7f27ade17fef5d9170,2013-11-13T00:55Z
2354,2013,0840b13612a0b7ef1ce7441cf811dcfc6b463fba,"The ModSecurity module before 2.7.4 for the Apache HTTP Server allows remote attackers to cause a denial of service (NULL pointer dereference, process crash, and disk consumption) via a POST request with a large body and a crafted Content-Type header.",http://github.com/SpiderLabs/ModSecurity/commit/0840b13612a0b7ef1ce7441cf811dcfc6b463fba,2013-07-15T15:55Z
2429,2013,cea4dcfdad926a27a18e188720efe0f2c9403456,Heap-based buffer overflow in the iscsi_add_notunderstood_response function in drivers/target/iscsi/iscsi_target_parameters.c in the iSCSI target subsystem in the Linux kernel through 3.9.4 allows remote attackers to cause a denial of service (memory corruption and OOPS) or possibly execute arbitrary code via a long key that is not properly handled during construction of an error-response packet.,http://github.com/torvalds/linux/commit/cea4dcfdad926a27a18e188720efe0f2c9403456,2013-06-07T14:03Z
2508,2013,d049f74f2dbe71354d43d393ac3a188947811348,"The Linux kernel before 3.12.2 does not properly use the get_dumpable function, which allows local users to bypass intended ptrace restrictions or obtain sensitive information from IA64 scratch registers via a crafted application, related to kernel/ptrace.c and arch/ia64/include/asm/processor.h.",http://github.com/torvalds/linux/commit/d049f74f2dbe71354d43d393ac3a188947811348,2013-12-09T18:55Z
2509,2013,12ae030d54ef250706da5642fc7697cc60ad0df7,"The perf_trace_event_perm function in kernel/trace/trace_event_perf.c in the Linux kernel before 3.12.2 does not properly restrict access to the perf subsystem, which allows local users to enable function tracing via a crafted application.",http://github.com/torvalds/linux/commit/12ae030d54ef250706da5642fc7697cc60ad0df7,2013-12-09T18:55Z
2624,2013,72a763d805a48ac8c0bf48fdb510e84c12de51fe,"The crypto API in the Linux kernel through 3.9-rc8 does not initialize certain length variables, which allows local users to obtain sensitive information from kernel stack memory via a crafted recvmsg or recvfrom system call, related to the hash_recvmsg function in crypto/algif_hash.c and the skcipher_recvmsg function in crypto/algif_skcipher.c.",http://github.com/torvalds/linux/commit/72a763d805a48ac8c0bf48fdb510e84c12de51fe,2013-04-22T11:40Z
2628,2013,972757c4500d94b4b1306bf092e678add3a987d8,SQL injection vulnerability in the checkEmailFormat function in plugins/jojo_core/classes/Jojo.php in Jojo before 1.2.2 allows remote attackers to execute arbitrary SQL commands via the X-Forwarded-For HTTP header to /articles/test/.,http://github.com/JojoCMS/Jojo-CMS/commit/972757c4500d94b4b1306bf092e678add3a987d8,2014-06-09T19:55Z
2629,2013,9c000f961635e35e9984a8c16ca69c2cbf2d2236,Cross-site scripting (XSS) vulnerability in plugins/jojo_core/forgot_password.php in Jojo before 1.2.2 allows remote attackers to inject arbitrary web script or HTML via the search parameter to forgot-password/.,http://github.com/JojoCMS/Jojo-CMS/commit/9c000f961635e35e9984a8c16ca69c2cbf2d2236,2014-06-09T19:55Z
2747,2013,9b3e617f3df53822345a8573b6d358f6b9e5ed87,"The vcc_recvmsg function in net/atm/common.c in the Linux kernel before 3.9-rc7 does not initialize a certain length variable, which allows local users to obtain sensitive information from kernel stack memory via a crafted recvmsg or recvfrom system call.",http://github.com/torvalds/linux/commit/9b3e617f3df53822345a8573b6d358f6b9e5ed87,2013-04-22T11:41Z
2748,2013,ef3313e84acbf349caecae942ab3ab731471f1a1,"The ax25_recvmsg function in net/ax25/af_ax25.c in the Linux kernel before 3.9-rc7 does not initialize a certain data structure, which allows local users to obtain sensitive information from kernel stack memory via a crafted recvmsg or recvfrom system call.",http://github.com/torvalds/linux/commit/ef3313e84acbf349caecae942ab3ab731471f1a1,2013-04-22T11:41Z
2749,2013,4683f42fde3977bdb4e8a09622788cc8b5313778,"The bt_sock_recvmsg function in net/bluetooth/af_bluetooth.c in the Linux kernel before 3.9-rc7 does not properly initialize a certain length variable, which allows local users to obtain sensitive information from kernel stack memory via a crafted recvmsg or recvfrom system call.",http://github.com/torvalds/linux/commit/4683f42fde3977bdb4e8a09622788cc8b5313778,2013-04-22T11:41Z
2750,2013,e11e0455c0d7d3d62276a0c55d9dfbc16779d691,"The rfcomm_sock_recvmsg function in net/bluetooth/rfcomm/sock.c in the Linux kernel before 3.9-rc7 does not initialize a certain length variable, which allows local users to obtain sensitive information from kernel stack memory via a crafted recvmsg or recvfrom system call.",http://github.com/torvalds/linux/commit/e11e0455c0d7d3d62276a0c55d9dfbc16779d691,2013-04-22T11:41Z
2751,2013,c8c499175f7d295ef867335bceb9a76a2c3cdc38,"The sco_sock_recvmsg function in net/bluetooth/sco.c in the Linux kernel before 3.9-rc7 does not initialize a certain length variable, which allows local users to obtain sensitive information from kernel stack memory via a crafted recvmsg or recvfrom system call.",http://github.com/torvalds/linux/commit/c8c499175f7d295ef867335bceb9a76a2c3cdc38,2013-04-22T11:41Z
2752,2013,2d6fbfe733f35c6b355c216644e08e149c61b271,"The caif_seqpkt_recvmsg function in net/caif/caif_socket.c in the Linux kernel before 3.9-rc7 does not initialize a certain length variable, which allows local users to obtain sensitive information from kernel stack memory via a crafted recvmsg or recvfrom system call.",http://github.com/torvalds/linux/commit/2d6fbfe733f35c6b355c216644e08e149c61b271,2013-04-22T11:41Z
2753,2013,5ae94c0d2f0bed41d6718be743985d61b7f5c47d,"The irda_recvmsg_dgram function in net/irda/af_irda.c in the Linux kernel before 3.9-rc7 does not initialize a certain length variable, which allows local users to obtain sensitive information from kernel stack memory via a crafted recvmsg or recvfrom system call.",http://github.com/torvalds/linux/commit/5ae94c0d2f0bed41d6718be743985d61b7f5c47d,2013-04-22T11:41Z
2754,2013,a5598bd9c087dc0efc250a5221e5d0e6f584ee88,"The iucv_sock_recvmsg function in net/iucv/af_iucv.c in the Linux kernel before 3.9-rc7 does not initialize a certain length variable, which allows local users to obtain sensitive information from kernel stack memory via a crafted recvmsg or recvfrom system call.",http://github.com/torvalds/linux/commit/a5598bd9c087dc0efc250a5221e5d0e6f584ee88,2013-04-22T11:41Z
2755,2013,b860d3cc62877fad02863e2a08efff69a19382d2,"The l2tp_ip6_recvmsg function in net/l2tp/l2tp_ip6.c in the Linux kernel before 3.9-rc7 does not initialize a certain structure member, which allows local users to obtain sensitive information from kernel stack memory via a crafted recvmsg or recvfrom system call.",http://github.com/torvalds/linux/commit/b860d3cc62877fad02863e2a08efff69a19382d2,2013-04-22T11:41Z
2756,2013,c77a4b9cffb6215a15196ec499490d116dfad181,"The llc_ui_recvmsg function in net/llc/af_llc.c in the Linux kernel before 3.9-rc7 does not initialize a certain length variable, which allows local users to obtain sensitive information from kernel stack memory via a crafted recvmsg or recvfrom system call.",http://github.com/torvalds/linux/commit/c77a4b9cffb6215a15196ec499490d116dfad181,2013-04-22T11:41Z
2757,2013,3ce5efad47b62c57a4f5c54248347085a750ce0e,"The nr_recvmsg function in net/netrom/af_netrom.c in the Linux kernel before 3.9-rc7 does not initialize a certain data structure, which allows local users to obtain sensitive information from kernel stack memory via a crafted recvmsg or recvfrom system call.",http://github.com/torvalds/linux/commit/3ce5efad47b62c57a4f5c54248347085a750ce0e,2013-04-22T11:41Z
2757,2013,c802d759623acbd6e1ee9fbdabae89159a513913,"The nr_recvmsg function in net/netrom/af_netrom.c in the Linux kernel before 3.9-rc7 does not initialize a certain data structure, which allows local users to obtain sensitive information from kernel stack memory via a crafted recvmsg or recvfrom system call.",http://github.com/torvalds/linux/commit/c802d759623acbd6e1ee9fbdabae89159a513913,2013-04-22T11:41Z
2758,2013,d26d6504f23e803824e8ebd14e52d4fc0a0b09cb,"The llcp_sock_recvmsg function in net/nfc/llcp/sock.c in the Linux kernel before 3.9-rc7 does not initialize a certain length variable and a certain data structure, which allows local users to obtain sensitive information from kernel stack memory via a crafted recvmsg or recvfrom system call.",http://github.com/torvalds/linux/commit/d26d6504f23e803824e8ebd14e52d4fc0a0b09cb,2013-04-22T11:41Z
2759,2013,4a184233f21645cf0b719366210ed445d1024d72,"The rose_recvmsg function in net/rose/af_rose.c in the Linux kernel before 3.9-rc7 does not initialize a certain data structure, which allows local users to obtain sensitive information from kernel stack memory via a crafted recvmsg or recvfrom system call.",http://github.com/torvalds/linux/commit/4a184233f21645cf0b719366210ed445d1024d72,2013-04-22T11:41Z
2760,2013,60085c3d009b0df252547adb336d1ccca5ce52ec,"net/tipc/socket.c in the Linux kernel before 3.9-rc7 does not initialize a certain data structure and a certain length variable, which allows local users to obtain sensitive information from kernel stack memory via a crafted recvmsg or recvfrom system call.",http://github.com/torvalds/linux/commit/60085c3d009b0df252547adb336d1ccca5ce52ec,2013-04-22T11:41Z
2761,2013,680d04e0ba7e926233e3b9cee59125ce181f66ba,"The vmci_transport_dgram_dequeue function in net/vmw_vsock/vmci_transport.c in the Linux kernel before 3.9-rc7 does not properly initialize a certain length variable, which allows local users to obtain sensitive information from kernel stack memory via a crafted recvmsg or recvfrom system call.",http://github.com/torvalds/linux/commit/680d04e0ba7e926233e3b9cee59125ce181f66ba,2013-04-22T11:41Z
2762,2013,d5e0d0f607a7a029c6563a0470d88255c89a8d11,"The vsock_stream_sendmsg function in net/vmw_vsock/af_vsock.c in the Linux kernel before 3.9-rc7 does not initialize a certain length variable, which allows local users to obtain sensitive information from kernel stack memory via a crafted recvmsg or recvfrom system call.",http://github.com/torvalds/linux/commit/d5e0d0f607a7a029c6563a0470d88255c89a8d11,2013-04-22T11:41Z
2763,2013,dedd542cdaf1606ca9aa3f6f8f8adb078d8ad549,"phpMyAdmin 3.5.x before 3.5.8 and 4.x before 4.0.0-rc3 allows remote authenticated users to execute arbitrary code via a /e\x00 sequence, which is not properly handled before making a preg_replace function call within the ""Replace table prefix"" feature.",http://github.com/phpmyadmin/phpmyadmin/commit/dedd542cdaf1606ca9aa3f6f8f8adb078d8ad549,2013-04-26T03:34Z
2763,2013,ffa720d90a79c1f33cf4c5a33403d09a67b42a66,"phpMyAdmin 3.5.x before 3.5.8 and 4.x before 4.0.0-rc3 allows remote authenticated users to execute arbitrary code via a /e\x00 sequence, which is not properly handled before making a preg_replace function call within the ""Replace table prefix"" feature.",http://github.com/phpmyadmin/phpmyadmin/commit/ffa720d90a79c1f33cf4c5a33403d09a67b42a66,2013-04-26T03:34Z
2764,2013,1f6bc0b707002e26cab216b9e57b4d5de764de48,"phpMyAdmin 3.5.x before 3.5.8 and 4.x before 4.0.0-rc3, when a SaveDir directory is configured, allows remote authenticated users to execute arbitrary code by using a double extension in the filename of an export file, leading to interpretation of this file as an executable file by the Apache HTTP Server, as demonstrated by a .php.sql filename.",http://github.com/phpmyadmin/phpmyadmin/commit/1f6bc0b707002e26cab216b9e57b4d5de764de48,2013-04-26T03:34Z
2764,2013,d3fafdfba0807068196655e9b6d16c5d1d3ccf8a,"phpMyAdmin 3.5.x before 3.5.8 and 4.x before 4.0.0-rc3, when a SaveDir directory is configured, allows remote authenticated users to execute arbitrary code by using a double extension in the filename of an export file, leading to interpretation of this file as an executable file by the Apache HTTP Server, as demonstrated by a .php.sql filename.",http://github.com/phpmyadmin/phpmyadmin/commit/d3fafdfba0807068196655e9b6d16c5d1d3ccf8a,2013-04-26T03:34Z
2814,2013,099d9c86cf6d81f4953957add478ab699946e601,"The JsonParser class in json/JsonParser.scala in Lift before 2.5 interprets a certain end-index value as a length value, which allows remote authenticated users to obtain sensitive information from other users' sessions via invalid input data containing a < (less than) character.",http://github.com/lift/framework/commit/099d9c86cf6d81f4953957add478ab699946e601,2013-07-29T13:59Z
2815,2013,6a76f8c0ab19f215af2a3442870eeb5f0e81998d,"The ftrace implementation in the Linux kernel before 3.8.8 allows local users to cause a denial of service (NULL pointer dereference and system crash) or possibly have unspecified other impact by leveraging the CAP_SYS_ADMIN capability for write access to the (1) set_ftrace_pid or (2) set_graph_function file, and then making an lseek system call.",http://github.com/torvalds/linux/commit/6a76f8c0ab19f215af2a3442870eeb5f0e81998d,2013-04-29T14:55Z
2816,2013,ea702b80e0bbb2448e201472127288beb82ca2fe,Race condition in the smb_send_rqst function in fs/cifs/transport.c in the Linux kernel before 3.7.2 allows local users to cause a denial of service (NULL pointer dereference and OOPS) or possibly have unspecified other impact via vectors involving a reconnection event.,http://github.com/torvalds/linux/commit/ea702b80e0bbb2448e201472127288beb82ca2fe,2013-04-29T14:55Z
3000,2013,5cadf9cbf4d0872a879666ea594be356fad5897e,SQL injection vulnerability in popupnewsitem/ in the Pop Up News module 2.0 and possibly earlier for phpVMS allows remote attackers to execute arbitrary SQL commands via the itemid parameter.  NOTE: this was originally reported as a problem in phpVMS.,http://github.com/DavidJClark/phpVMS-PopUpNews/commit/5cadf9cbf4d0872a879666ea594be356fad5897e,2013-05-10T21:55Z
3000,2013,efaffa04ef87db1722d69ac7bfc07be71ce2dccf,SQL injection vulnerability in popupnewsitem/ in the Pop Up News module 2.0 and possibly earlier for phpVMS allows remote attackers to execute arbitrary SQL commands via the itemid parameter.  NOTE: this was originally reported as a problem in phpVMS.,http://github.com/DavidJClark/phpVMS-PopUpNews/commit/efaffa04ef87db1722d69ac7bfc07be71ce2dccf,2013-05-10T21:55Z
3003,2013,83078591bc4d263e77d2a2ca283100997755290d,Multiple SQL injection vulnerabilities in Vanilla Forums before 2.0.18.8 allow remote attackers to execute arbitrary SQL commands via the parameter name in the Form/Email array to (1) entry/signin or (2) entry/passwordrequest.,http://github.com/vanillaforums/Garden/commit/83078591bc4d263e77d2a2ca283100997755290d,2013-05-10T21:55Z
3004,2013,b9a10dabb15c697347bfa7baef69a6e211b2f804,"Unspecified vulnerability in the update check in Vanilla Forums before 2.0.18.8 has unspecified impact and remote attack vectors, related to ""object injection.""",http://github.com/vanillaforums/Garden/commit/b9a10dabb15c697347bfa7baef69a6e211b2f804,2013-05-10T21:55Z
3137,2013,06ad7fdbdd7eb2fef8947d14c4cdd00d8f6387b1,"The controller of the Open Build Service API prior to version 2.4.4 is missing a write permission check, allowing an authenticated attacker to add or remove user roles from packages and/or project meta data.",http://github.com/openSUSE/open-build-service/commit/06ad7fdbdd7eb2fef8947d14c4cdd00d8f6387b1,2018-06-08T17:29Z
