cveid,year,hash,desc,link,publishedDate4108,2013,4b0faa90fa8b9e1776c86db716894dcd7e6b4834,Cross-site request forgery (CSRF) vulnerability in core/admin/modules/users/create.php in BigTree CMS 4.0 RC2 and earlier allows remote attackers to hijack the authentication of administrators for requests that create an administrative user via an add user action to index.php.,http://github.com/bigtreecms/BigTree-CMS/commit/4b0faa90fa8b9e1776c86db716894dcd7e6b4834,2013-08-19T13:07Z
4112,2013,1791fe4e2b9e5b5c8e000551ab60a64a29d924c3,"The http-domino-enum-passwords.nse script in NMap before 6.40, when domino-enum-passwords.idpath is set, allows remote servers to upload ""arbitrarily named"" files via a crafted FullName parameter in a response, as demonstrated using directory traversal sequences.",http://github.com/drk1wi/portspoof/commit/1791fe4e2b9e5b5c8e000551ab60a64a29d924c3,2013-10-26T17:55Z
4216,2013,240b8332db53dedc27baeec5306dabad3bdece3b,phpMyAdmin 3.5.x and 4.0.x before 4.0.5 allows remote attackers to bypass the clickjacking protection mechanism via certain vectors related to Header.class.php.,http://github.com/phpmyadmin/phpmyadmin/commit/240b8332db53dedc27baeec5306dabad3bdece3b,2013-08-19T23:55Z
4216,2013,24d0eb55203b029f250c77d63f2900ffbe099e8b,phpMyAdmin 3.5.x and 4.0.x before 4.0.5 allows remote attackers to bypass the clickjacking protection mechanism via certain vectors related to Header.class.php.,http://github.com/phpmyadmin/phpmyadmin/commit/24d0eb55203b029f250c77d63f2900ffbe099e8b,2013-08-19T23:55Z
4216,2013,66fe475d4f51b1761719cb0cab360748800373f7,phpMyAdmin 3.5.x and 4.0.x before 4.0.5 allows remote attackers to bypass the clickjacking protection mechanism via certain vectors related to Header.class.php.,http://github.com/phpmyadmin/phpmyadmin/commit/66fe475d4f51b1761719cb0cab360748800373f7,2013-08-19T23:55Z
4216,2013,da4042fb6c4365dc8187765c3bf525043687c66f,phpMyAdmin 3.5.x and 4.0.x before 4.0.5 allows remote attackers to bypass the clickjacking protection mechanism via certain vectors related to Header.class.php.,http://github.com/phpmyadmin/phpmyadmin/commit/da4042fb6c4365dc8187765c3bf525043687c66f,2013-08-19T23:55Z
4223,2013,6d667c19e96e4f23dccbfbe24afeebd18e98e1c5,The Square Squash allows remote attackers to execute arbitrary code via a YAML document in the (1) namespace parameter to the deobfuscation function or (2) sourcemap parameter to the sourcemap function in app/controllers/api/v1_controller.rb.,http://github.com/SquareSquash/web/commit/6d667c19e96e4f23dccbfbe24afeebd18e98e1c5,2014-05-27T14:55Z
4398,2013,4b0faa90fa8b9e1776c86db716894dcd7e6b4834,Cross-site request forgery (CSRF) vulnerability in core/admin/modules/users/update.php in BigTree CMS 4.0 RC2 and earlier allows remote attackers to hijack the authentication of administrators for requests that modify arbitrary user accounts via an edit user action.,http://github.com/bigtreecms/BigTree-CMS/commit/4b0faa90fa8b9e1776c86db716894dcd7e6b4834,2013-08-19T21:10Z
4628,2013,1ed07e257a2c0794ba19e864f7c5101e7e8c41d2,"administrator/components/com_media/helpers/media.php in the media manager in Joomla! 2.5.x before 2.5.14 and 3.x before 3.1.5 allows remote authenticated users or remote attackers to bypass intended access restrictions and upload files with dangerous extensions via a filename with a trailing . (dot), as exploited in the wild in August 2013.",http://github.com/joomla/joomla-cms/commit/1ed07e257a2c0794ba19e864f7c5101e7e8c41d2,2013-10-09T14:54Z
4628,2013,fa5645208eefd70f521cd2e4d53d5378622133d8,"administrator/components/com_media/helpers/media.php in the media manager in Joomla! 2.5.x before 2.5.14 and 3.x before 3.1.5 allows remote authenticated users or remote attackers to bypass intended access restrictions and upload files with dangerous extensions via a filename with a trailing . (dot), as exploited in the wild in August 2013.",http://github.com/joomla/joomla-cms/commit/fa5645208eefd70f521cd2e4d53d5378622133d8,2013-10-09T14:54Z
4677,2013,e8180dcaa8470ceca21109f143876fdcd9fe050a,"arch/arm/kvm/arm.c in the Linux kernel before 3.10 on the ARM platform, when KVM is used, allows host OS users to cause a denial of service (NULL pointer dereference, OOPS, and host OS crash) or possibly have unspecified other impact by omitting vCPU initialization before a KVM_GET_REG_LIST ioctl call.",http://github.com/torvalds/linux/commit/e8180dcaa8470ceca21109f143876fdcd9fe050a,2013-09-25T10:31Z
4726,2013,f8d441cd25172fdfe5b613442fedfc0da3cc333d,apache2/modsecurity.c in ModSecurity before 2.7.6 allows remote attackers to bypass rules by using chunked transfer coding with a capitalized Chunked value in the Transfer-Encoding HTTP header.,http://github.com/SpiderLabs/ModSecurity/commit/f8d441cd25172fdfe5b613442fedfc0da3cc333d,2014-04-15T10:55Z
4966,2013,9177d134960c24cb642d5cf3b42a1fba286219cc,Directory traversal vulnerability in userfiles/modules/admin/backup/delete.php in Microweber before 0.830 allows remote attackers to delete arbitrary files via a .. (dot dot) in the file parameter.,http://github.com/microweber/microweber/commit/9177d134960c24cb642d5cf3b42a1fba286219cc,2014-05-12T14:55Z
5021,2013,1a274ccd6bc1afbdac80344c9b6e5810c1162b5f,"The is_safe_url function in utils/http.py in Django 1.4.x before 1.4.6, 1.5.x before 1.5.2, and 1.6 before beta 2 treats a URL's scheme as safe even if it is not HTTP or HTTPS, which might introduce cross-site scripting (XSS) or other vulnerabilities into Django applications that use this function, as demonstrated by ""the login view in django.contrib.auth.views"" and the javascript: scheme.",http://github.com/django/django/commit/1a274ccd6bc1afbdac80344c9b6e5810c1162b5f,2013-10-04T17:55Z
5021,2013,ae3535169af804352517b7fea94a42a1c9c4b762,"The is_safe_url function in utils/http.py in Django 1.4.x before 1.4.6, 1.5.x before 1.5.2, and 1.6 before beta 2 treats a URL's scheme as safe even if it is not HTTP or HTTPS, which might introduce cross-site scripting (XSS) or other vulnerabilities into Django applications that use this function, as demonstrated by ""the login view in django.contrib.auth.views"" and the javascript: scheme.",http://github.com/django/django/commit/ae3535169af804352517b7fea94a42a1c9c4b762,2013-10-04T17:55Z
5021,2013,ec67af0bd609c412b76eaa4cc89968a2a8e5ad6a,"The is_safe_url function in utils/http.py in Django 1.4.x before 1.4.6, 1.5.x before 1.5.2, and 1.6 before beta 2 treats a URL's scheme as safe even if it is not HTTP or HTTPS, which might introduce cross-site scripting (XSS) or other vulnerabilities into Django applications that use this function, as demonstrated by ""the login view in django.contrib.auth.views"" and the javascript: scheme.",http://github.com/django/django/commit/ec67af0bd609c412b76eaa4cc89968a2a8e5ad6a,2013-10-04T17:55Z
5024,2013,284d7402718d98fcf10cee565415939882abab99,The get_group_tree function in lib/Munin/Master/HTMLConfig.pm in Munin before 2.0.18 allows remote nodes to cause a denial of service (infinite loop and memory consumption in the munin-html process) via crafted multigraph data.,http://github.com/munin-monitoring/munin/commit/284d7402718d98fcf10cee565415939882abab99,2013-12-13T18:55Z
5196,2013,8404663f81d212918ff85f493649a7991209fa04,"The (1) get_user and (2) put_user API functions in the Linux kernel before 3.5.5 on the v6k and v7 ARM platforms do not validate certain addresses, which allows attackers to read or modify the contents of arbitrary kernel memory locations via a crafted application, as exploited in the wild against Android devices in October and November 2013.",http://github.com/torvalds/linux/commit/8404663f81d212918ff85f493649a7991209fa04,2013-11-20T13:19Z
5254,2013,b963a22e6d1a266a67e9eecc88134713fd54775c,The apic_get_tmcct function in arch/x86/kvm/lapic.c in the KVM subsystem in the Linux kernel through 3.12.5 allows guest OS users to cause a denial of service (divide-by-zero error and host OS crash) via crafted modifications of the TMICT value.,http://github.com/torvalds/linux/commit/b963a22e6d1a266a67e9eecc88134713fd54775c,2013-12-14T18:08Z
5255,2013,fda4e2e85589191b123d31cdc21fd33ee70f50fd,The KVM subsystem in the Linux kernel through 3.12.5 allows local users to gain privileges or cause a denial of service (system crash) via a VAPIC synchronization operation involving a page-end address.,http://github.com/torvalds/linux/commit/fda4e2e85589191b123d31cdc21fd33ee70f50fd,2013-12-14T18:08Z
5257,2013,64e36901a0614bf64a19bc3396469c66dcd0b015,Buffer overflow in the printbuf APIs in json-c before 0.12 allows remote attackers to cause a denial of service via unspecified vectors.,http://github.com/json-c/json-c/commit/64e36901a0614bf64a19bc3396469c66dcd0b015,2014-04-22T13:06Z
5258,2013,64e36901a0614bf64a19bc3396469c66dcd0b015,"The hash functionality in json-c before 0.12 allows context-dependent attackers to cause a denial of service (CPU consumption) via crafted JSON data, involving collisions.",http://github.com/json-c/json-c/commit/64e36901a0614bf64a19bc3396469c66dcd0b015,2014-04-22T13:06Z
5259,2013,7d4562d6f7e40de04bbe29577b51c79f07d05ba6,"The Subversion plugin before 1.54 for Jenkins stores credentials using base64 encoding, which allows local users to obtain passwords and SSH private keys by reading a subversion.credentials file.",http://github.com/jenkinsci/subversion-plugin/commit/7d4562d6f7e40de04bbe29577b51c79f07d05ba6,2014-05-08T14:29Z
5263,2013,17d68b763f09a9ce824ae23eb62c9efc57b69271,The recalculate_apic_map function in arch/x86/kvm/lapic.c in the KVM subsystem in the Linux kernel through 3.12.5 allows guest OS users to cause a denial of service (host OS crash) via a crafted ICR write operation in x2apic mode.,http://github.com/torvalds/linux/commit/17d68b763f09a9ce824ae23eb62c9efc57b69271,2013-12-14T18:08Z
5265,2013,a497e47d4aec37aaf8f13509f3ef3d1f6a717d88,The lbs_debugfs_write function in drivers/net/wireless/libertas/debugfs.c in the Linux kernel through 3.12.1 allows local users to cause a denial of service (OOPS) by leveraging root privileges for a zero-length write operation.,http://github.com/torvalds/linux/commit/a497e47d4aec37aaf8f13509f3ef3d1f6a717d88,2013-11-27T04:43Z
5267,2013,b4789b8e6be3151a955ade74872822f30e8cd914,"The aac_send_raw_srb function in drivers/scsi/aacraid/commctrl.c in the Linux kernel through 3.12.1 does not properly validate a certain size value, which allows local users to cause a denial of service (invalid pointer dereference) or possibly have unspecified other impact via an FSACTL_SEND_RAW_SRB ioctl call that triggers a crafted SRB command.",http://github.com/torvalds/linux/commit/b4789b8e6be3151a955ade74872822f30e8cd914,2013-11-27T04:43Z
5268,2013,6fb392b1a63ae36c31f62bc3fc8630b49d602b62,Buffer overflow in the qeth_snmp_command function in drivers/s390/net/qeth_core_main.c in the Linux kernel through 3.12.1 allows local users to cause a denial of service or possibly have unspecified other impact via an SNMP ioctl call with a length value that is incompatible with the command-buffer size.,http://github.com/torvalds/linux/commit/6fb392b1a63ae36c31f62bc3fc8630b49d602b62,2013-11-27T04:43Z
5270,2013,f856567b930dfcdbc3323261bf77240ccdde01f5,"The aac_compat_ioctl function in drivers/scsi/aacraid/linit.c in the Linux kernel before 3.11.8 does not require the CAP_SYS_RAWIO capability, which allows local users to bypass intended access restrictions via a crafted ioctl call.",http://github.com/torvalds/linux/commit/f856567b930dfcdbc3323261bf77240ccdde01f5,2013-11-27T04:43Z
5287,2013,8f80c2d83808150724d31793e6ade92749b1faa4,"Jansson, possibly 2.4 and earlier, does not restrict the ability to trigger hash collisions predictably, which allows context-dependent attackers to cause a denial of service (CPU consumption) via a crafted JSON document.",http://github.com/akheron/jansson/commit/8f80c2d83808150724d31793e6ade92749b1faa4,2014-03-21T01:04Z
5290,2013,a1a24da,"Quassel core (server daemon) in Quassel IRC before 0.9.2 does not properly verify the user ID when accessing user backlogs, which allows remote authenticated users to read other users' backlogs via the bufferid in (1) 16/select_buffer_by_id.sql, (2) 16/select_buffer_by_id.sql, and (3) 16/select_buffer_by_id.sql in core/SQL/PostgreSQL/.",http://github.com/quassel/quassel/commit/a1a24da,2013-12-09T16:36Z
5298,2013,f5b4fc0c,"The transform_save function in transform.c in Augeas 1.0.0 through 1.1.0 does not properly calculate the permission values when the umask contains a ""7,"" which causes world-writable permissions to be used for new files and allows local users to modify the files via unspecified vectors.",http://github.com/hercules-team/augeas/commit/f5b4fc0c,2014-01-23T00:55Z
5315,2013,ae7b4e1f213aa659aedf9c6ecad0bf5f0476e1e2,"The fib6_add function in net/ipv6/ip6_fib.c in the Linux kernel before 3.11.5 does not properly implement error-code encoding, which allows local users to cause a denial of service (NULL pointer dereference and system crash) by leveraging the CAP_NET_ADMIN capability for an IPv6 SIOCADDRT ioctl call.",http://github.com/torvalds/linux/commit/ae7b4e1f213aa659aedf9c6ecad0bf5f0476e1e2,2013-12-09T18:55Z
5316,2013,cf970c002d270c36202bd5b9c2804d3097a52da0,"The ping_recvmsg function in net/ipv4/ping.c in the Linux kernel before 3.12.4 does not properly interact with read system calls on ping sockets, which allows local users to cause a denial of service (NULL pointer dereference and system crash) by leveraging unspecified privileges to execute a crafted application.",http://github.com/torvalds/linux/commit/cf970c002d270c36202bd5b9c2804d3097a52da0,2013-12-09T18:55Z
5325,2013,f4d5cc8e1f39d132b61e110674528cac727ae0e2,"The lxc-sshd template (templates/lxc-sshd.in) in LXC before 1.0.0.beta2 uses read-write permissions when mounting /sbin/init, which allows local users to gain privileges by modifying the init file.",http://github.com/lxc/lxc/commit/f4d5cc8e1f39d132b61e110674528cac727ae0e2,2014-02-14T15:55Z
5331,2013,090aa6252affc978a96c388e3fc2c1c2688d9bb5,"Multiple XML External Entity (XXE) vulnerabilities in the (1) ExecutionHandler, (2) PollHandler, and (3) SubscriptionHandler classes in JBoss Seam Remoting in JBoss Seam 2 framework 2.3.1 and earlier, as used in JBoss Web Framework Kit, allow remote attackers to read arbitrary files and possibly have other impacts via a crafted XML file.",http://github.com/seam2/jboss-seam/commit/090aa6252affc978a96c388e3fc2c1c2688d9bb5,2014-01-23T00:55Z
5332,2013,090aa6252affc978a96c388e3fc2c1c2688d9bb5,"The InterfaceGenerator handler in JBoss Seam Remoting in JBoss Seam 2 framework 2.3.1 and earlier, as used in JBoss Web Framework Kit, allows remote attackers to bypass the WebRemote annotation restriction and obtain information about arbitrary classes and methods on the server classpath via unspecified vectors.",http://github.com/seam2/jboss-seam/commit/090aa6252affc978a96c388e3fc2c1c2688d9bb5,2014-01-23T00:55Z
5344,2013,4818204506e8e94645b52adb9426bedfa9ffdd04,Multiple cross-site scripting (XSS) vulnerabilities in JBPM KIE Workbench 6.0.x allow remote authenticated users to inject arbitrary web script or HTML via vectors related to task name html inputs.,http://github.com/kiegroup/jbpm-wb/commit/4818204506e8e94645b52adb9426bedfa9ffdd04,2017-12-19T19:29Z
5621,2013,7314e613d5ff9f0934f7a0f74ed7973b903315d1,"The uio_mmap_physical function in drivers/uio/uio.c in the Linux kernel before 3.12 does not validate the size of a memory block, which allows local users to cause a denial of service (memory corruption) or possibly gain privileges via crafted mmap operations, a different vulnerability than CVE-2013-4511.",http://github.com/torvalds/linux/commit/7314e613d5ff9f0934f7a0f74ed7973b903315d1,2013-11-12T14:35Z
5636,2013,3e88c98ca513880e2b43ed7f27ade17fef5d9170,"security/MemberLoginForm.php in SilverStripe 3.0.3 supports credentials in a GET request, which allows remote or local attackers to obtain sensitive information by reading web-server access logs, web-server Referer logs, or the browser history, a similar vulnerability to CVE-2013-2653.",http://github.com/chillu/silverstripe-framework/commit/3e88c98ca513880e2b43ed7f27ade17fef5d9170,2013-11-13T00:55Z
5640,2013,ef16f88f20254b8083e361f11707da25f8482401,"The Updater in Rackspace Openstack Windows Guest Agent for XenServer before 1.2.6.0 allows remote attackers to execute arbitrary code via a crafted serialized .NET object to TCP port 1984, which triggers the download and extraction of a ZIP file that overwrites the Agent service binary.",http://github.com/rackerlabs/openstack-guest-agents-windows-xenserver/commit/ef16f88f20254b8083e361f11707da25f8482401,2013-12-24T18:55Z
5645,2013,c2ccf4197f697c4ff143b8a786acdd875e70a89d,"An unspecified third-party database module for the Key Distribution Center (KDC) in MIT Kerberos 5 (aka krb5) 1.10.x allows remote authenticated users to cause a denial of service (NULL pointer dereference and daemon crash) via a crafted request, a different vulnerability than CVE-2013-1418.",http://github.com/krb5/krb5/commit/c2ccf4197f697c4ff143b8a786acdd875e70a89d,2013-11-18T02:55Z
5679,2013,3ef0ddfefebbcc6bbe9245f9cea87e26838e9bbc,Cross-site scripting (XSS) vulnerability in the setTimeout function in js/jquery.prettyPhoto.js in prettyPhoto 3.1.4 and earlier allows remote attackers to inject arbitrary web script or HTML via a crafted PATH_INTO to the default URI.,http://github.com/Duncaen/prettyphoto/commit/3ef0ddfefebbcc6bbe9245f9cea87e26838e9bbc,2013-12-19T04:24Z
5810,2013,29ffeef5e73b8f41ff3a3f2242d356759c66f91f,"The decode_slice_header function in libavcodec/h264.c in FFmpeg before 2.1 incorrectly relies on a certain droppable field, which allows remote attackers to cause a denial of service (deadlock) or possibly have unspecified other impact via crafted H.264 data.",http://github.com/FFmpeg/FFmpeg/commit/29ffeef5e73b8f41ff3a3f2242d356759c66f91f,2013-12-09T16:36Z
5811,2013,3819db745da2ac7fb3faacb116788c32f4753f34,"The rpza_decode_stream function in libavcodec/rpza.c in FFmpeg before 2.1 does not properly maintain a pointer to pixel data, which allows remote attackers to cause a denial of service (out-of-bounds array access) or possibly have unspecified other impact via crafted Apple RPZA data.",http://github.com/FFmpeg/FFmpeg/commit/3819db745da2ac7fb3faacb116788c32f4753f34,2013-12-09T16:36Z
5812,2013,454a11a1c9c686c78aa97954306fb63453299760,Multiple integer signedness errors in libavcodec/dsputil.c in FFmpeg before 2.1 allow remote attackers to cause a denial of service (out-of-bounds array access) or possibly have unspecified other impact via crafted data.,http://github.com/FFmpeg/FFmpeg/commit/454a11a1c9c686c78aa97954306fb63453299760,2013-12-09T16:36Z
5813,2013,547d690d676064069d44703a1917e0dab7e33445,"The read_header function in libavcodec/ffv1dec.c in FFmpeg before 2.1 does not prevent changes to global parameters, which allows remote attackers to cause a denial of service (out-of-bounds array access) or possibly have unspecified other impact via crafted FFV1 data.",http://github.com/FFmpeg/FFmpeg/commit/547d690d676064069d44703a1917e0dab7e33445,2013-12-09T16:36Z
5814,2013,780669ef7c23c00836a24921fcc6b03be2b8ca4a,"The get_siz function in libavcodec/jpeg2000dec.c in FFmpeg before 2.1 does not prevent attempts to use non-zero image offsets, which allows remote attackers to cause a denial of service (out-of-bounds array access) or possibly have unspecified other impact via crafted JPEG2000 data.",http://github.com/FFmpeg/FFmpeg/commit/780669ef7c23c00836a24921fcc6b03be2b8ca4a,2013-12-09T16:36Z
5815,2013,821a5938d100458f4d09d634041b05c860554ce0,"The g2m_init_buffers function in libavcodec/g2meet.c in FFmpeg before 2.1 uses an incorrect ordering of arithmetic operations, which allows remote attackers to cause a denial of service (out-of-bounds array access) or possibly have unspecified other impact via crafted Go2Webinar data.",http://github.com/FFmpeg/FFmpeg/commit/821a5938d100458f4d09d634041b05c860554ce0,2013-12-09T16:36Z
5816,2013,86736f59d6a527d8bc807d09b93f971c0fe0bb07,Integer signedness error in the add_bytes_l2_c function in libavcodec/pngdsp.c in FFmpeg before 2.1 allows remote attackers to cause a denial of service (out-of-bounds array access) or possibly have unspecified other impact via crafted PNG data.,http://github.com/FFmpeg/FFmpeg/commit/86736f59d6a527d8bc807d09b93f971c0fe0bb07,2013-12-09T16:36Z
5817,2013,880c73cd76109697447fbfbaa8e5ee5683309446,"The flashsv_decode_frame function in libavcodec/flashsv.c in FFmpeg before 2.1 does not properly validate a certain height value, which allows remote attackers to cause a denial of service (out-of-bounds array access) or possibly have unspecified other impact via crafted Flash Screen Video data.",http://github.com/FFmpeg/FFmpeg/commit/880c73cd76109697447fbfbaa8e5ee5683309446,2013-12-09T16:36Z
5818,2013,8bb11c3ca77b52e05a9ed1496a65f8a76e6e2d8f,"The get_siz function in libavcodec/jpeg2000dec.c in FFmpeg before 2.1 does not ensure the expected sample separation, which allows remote attackers to cause a denial of service (out-of-bounds array access) or possibly have unspecified other impact via crafted JPEG2000 data.",http://github.com/FFmpeg/FFmpeg/commit/8bb11c3ca77b52e05a9ed1496a65f8a76e6e2d8f,2013-12-09T16:36Z
5819,2013,912ce9dd2080c5837285a471d750fa311e09b555,libavcodec/jpeg2000.c in FFmpeg before 2.1 allows remote attackers to cause a denial of service (invalid pointer dereference) or possibly have unspecified other impact via crafted JPEG2000 data.,http://github.com/FFmpeg/FFmpeg/commit/912ce9dd2080c5837285a471d750fa311e09b555,2013-12-09T16:36Z
5820,2013,9a271a9368eaabf99e6c2046103acb33957e63b7,"libavcodec/jpeg2000dec.c in FFmpeg before 2.1 does not ensure the use of valid code-block dimension values, which allows remote attackers to cause a denial of service (out-of-bounds array access) or possibly have unspecified other impact via crafted JPEG2000 data.",http://github.com/FFmpeg/FFmpeg/commit/9a271a9368eaabf99e6c2046103acb33957e63b7,2013-12-09T16:36Z
5821,2013,a1b9004b768bef606ee98d417bceb9392ceb788d,"The get_cox function in libavcodec/jpeg2000dec.c in FFmpeg before 2.1 does not properly validate the reduction factor, which allows remote attackers to cause a denial of service (out-of-bounds array access) or possibly have unspecified other impact via crafted JPEG2000 data.",http://github.com/FFmpeg/FFmpeg/commit/a1b9004b768bef606ee98d417bceb9392ceb788d,2013-12-09T16:36Z
5822,2013,b05cd1ea7e45a836f7f6071a716c38bb30326e0f,"The read_header function in libavcodec/ffv1dec.c in FFmpeg before 2.1 does not properly enforce certain bit-count and colorspace constraints, which allows remote attackers to cause a denial of service (out-of-bounds array access) or possibly have unspecified other impact via crafted FFV1 data.",http://github.com/FFmpeg/FFmpeg/commit/b05cd1ea7e45a836f7f6071a716c38bb30326e0f,2013-12-09T16:36Z
5823,2013,cdd5df8189ff1537f7abe8defe971f80602cc2d2,"The filter_frame function in libavfilter/vf_fps.c in FFmpeg before 2.1 does not properly ensure the availability of FIFO content, which allows remote attackers to cause a denial of service (double free) or possibly have unspecified other impact via crafted data.",http://github.com/FFmpeg/FFmpeg/commit/cdd5df8189ff1537f7abe8defe971f80602cc2d2,2013-12-09T16:36Z
5824,2013,e07ac727c1cc9eed39e7f9117c97006f719864bd,"The g2m_init_buffers function in libavcodec/g2meet.c in FFmpeg before 2.1 does not properly allocate memory for tiles, which allows remote attackers to cause a denial of service (out-of-bounds array access) or possibly have unspecified other impact via crafted Go2Webinar data.",http://github.com/FFmpeg/FFmpeg/commit/e07ac727c1cc9eed39e7f9117c97006f719864bd,2013-12-09T16:36Z
5825,2013,f31011e9abfb2ae75bb32bc44e2c34194c8dc40a,"The ff_combine_frame function in libavcodec/parser.c in FFmpeg before 2.1 does not properly handle certain memory-allocation errors, which allows remote attackers to cause a denial of service (out-of-bounds array access) or possibly have unspecified other impact via crafted data.",http://github.com/FFmpeg/FFmpeg/commit/f31011e9abfb2ae75bb32bc44e2c34194c8dc40a,2013-12-09T16:36Z
5826,2013,fe448cd28d674c3eff3072552eae366d0b659ce9,"The jpeg2000_decode_tile function in libavcodec/jpeg2000dec.c in FFmpeg before 2.1 does not consider the component number in certain calculations, which allows remote attackers to cause a denial of service (out-of-bounds array access) or possibly have unspecified other impact via crafted JPEG2000 data.",http://github.com/FFmpeg/FFmpeg/commit/fe448cd28d674c3eff3072552eae366d0b659ce9,2013-12-09T16:36Z
5828,2013,a399b29dfbaaaf91162b2dc5a5875dd51bbfa2a1,Multiple race conditions in ipc/shm.c in the Linux kernel before 3.12.2 allow local users to cause a denial of service (use-after-free and system crash) or possibly have unspecified other impact via a crafted application that uses shmctl IPC_RMID operations in conjunction with other shm system calls.,http://github.com/torvalds/linux/commit/a399b29dfbaaaf91162b2dc5a5875dd51bbfa2a1,2013-12-09T18:55Z
5829,2013,f5563318ff1bde15b10e736e97ffce13be08bc1a,"The ieee80211_radiotap_iterator_init function in net/wireless/radiotap.c in the Linux kernel before 3.11.7 does not check whether a frame contains any data outside of the header, which might allow attackers to cause a denial of service (buffer over-read) via a crafted header.",http://github.com/torvalds/linux/commit/f5563318ff1bde15b10e736e97ffce13be08bc1a,2013-12-09T18:55Z
5905,2013,edaa1bb8f73d6f3c8b2e78b67f1b40e02fccd0c1,"The ""remember me"" functionality in login.php in Burden before 1.8.1 allows remote attackers to bypass authentication and gain privileges by setting the burden_user_rememberme cookie to 1.",http://github.com/joshf/Burden/commit/edaa1bb8f73d6f3c8b2e78b67f1b40e02fccd0c1,2014-01-26T01:55Z
