cveid,year,hash,desc,link,publishedDate4207,2014,10014d4dc596b9e3a491bf04f3e708cf1887d5e1,"Cross-site scripting (XSS) vulnerability in the PMA_TRI_getRowForList function in libraries/rte/rte_list.lib.php in phpMyAdmin 4.0.x before 4.0.10.1, 4.1.x before 4.1.14.2, and 4.2.x before 4.2.6 allows remote authenticated users to inject arbitrary web script or HTML via a crafted trigger name that is improperly handled on the database triggers page.",http://github.com/phpmyadmin/phpmyadmin/commit/10014d4dc596b9e3a491bf04f3e708cf1887d5e1,2014-07-20T11:12Z
4222,2014,9c2cd3c93c05d009a91d84eedbb85873b0cb505d,The rs_filter_graph function in librawstudio/rs-filter.c in rawstudio might allow local users to truncate arbitrary files via a symlink attack on (1) /tmp/rs-filter-graph.png or (2) /tmp/rs-filter-graph.,http://github.com/rawstudio/rawstudio/commit/9c2cd3c93c05d009a91d84eedbb85873b0cb505d,2017-12-29T22:29Z
4225,2014,29a1f56495a7d1d98da31a614f23c0819a606a4d,"Multiple cross-site scripting (XSS) vulnerabilities in js/functions.js in phpMyAdmin 4.0.x before 4.0.10.1, 4.1.x before 4.1.14.2, and 4.2.x before 4.2.6 allow remote authenticated users to inject arbitrary web script or HTML via a crafted (1) table name or (2) column name that is improperly handled during construction of an AJAX confirmation message.",http://github.com/phpmyadmin/phpmyadmin/commit/29a1f56495a7d1d98da31a614f23c0819a606a4d,2014-07-20T11:12Z
4226,2014,395265e9937beb21134626c01a21f44b28e712e5,server_user_groups.php in phpMyAdmin 4.1.x before 4.1.14.2 and 4.2.x before 4.2.6 allows remote authenticated users to bypass intended access restrictions and read the MySQL user list via a viewUsers request.,http://github.com/phpmyadmin/phpmyadmin/commit/395265e9937beb21134626c01a21f44b28e712e5,2014-07-20T11:12Z
4247,2014,d23fbbd6c8434169967cf8bd2c5a4a0b569c352a,"Multiple cross-site scripting (XSS) vulnerabilities in LimeSurvey 2.05+ Build 140618 allow remote attackers to inject arbitrary web script or HTML via (1) the pid attribute to the getAttribute_json function to application/controllers/admin/participantsaction.php in CPDB, (2) the sa parameter to application/views/admin/globalSettings_view.php, or (3) a crafted CSV file to the ""Import CSV"" functionality.",http://github.com/LimeSurvey/LimeSurvey/commit/d23fbbd6c8434169967cf8bd2c5a4a0b569c352a,2014-07-21T14:55Z
4248,2014,9938bcd1df8ea27052557c722a67b00c0e7d6cb6,"SQL injection vulnerability in CPDB in application/controllers/admin/participantsaction.php in LimeSurvey 2.05+ Build 140618 allows remote attackers to execute arbitrary SQL commands via the sidx parameter in a JSON request to admin/participants/sa/getParticipants_json, related to a search parameter.",http://github.com/LimeSurvey/LimeSurvey/commit/9938bcd1df8ea27052557c722a67b00c0e7d6cb6,2014-07-21T14:55Z
4249,2014,3a6dd6b44cef2fa3f96f403e1cb971d8d0d694b5,"Incomplete blacklist vulnerability in the autoEscape function in common_helper.php in LimeSurvey 2.05+ Build 140618 allows remote attackers to conduct cross-site scripting (XSS) attacks via the GBK charset in the loadname parameter to index.php, related to the survey resume.",http://github.com/LimeSurvey/LimeSurvey/commit/3a6dd6b44cef2fa3f96f403e1cb971d8d0d694b5,2014-07-21T14:55Z
4273,2014,295dc39d941dc2ae53d5c170365af4c9d5c16212,"The mountpoint_last function in fs/namei.c in the Linux kernel before 3.15.8 does not properly maintain a certain reference count during attempts to use the umount system call in conjunction with a symlink, which allows local users to cause a denial of service (memory consumption or use-after-free) or possibly have unspecified other impact via the umount program.",http://github.com/torvalds/linux/commit/295dc39d941dc2ae53d5c170365af4c9d5c16212,2014-08-01T11:13Z
4283,2014,1be9a950c646c9092fb3618197f7b6bfb50e82aa,"The sctp_assoc_update function in net/sctp/associola.c in the Linux kernel through 3.15.8, when SCTP authentication is enabled, allows remote attackers to cause a denial of service (NULL pointer dereference and OOPS) by starting to establish an association between two endpoints immediately after an exchange of INIT and INIT ACK chunks to establish an earlier association between these endpoints in the opposite direction.",http://github.com/torvalds/linux/commit/1be9a950c646c9092fb3618197f7b6bfb50e82aa,2014-08-01T11:13Z
4373,2014,a6138db815df5ee542d848318e5dae681590fccd,"The do_remount function in fs/namespace.c in the Linux kernel through 3.16.1 does not maintain the MNT_LOCK_READONLY bit across a remount of a bind mount, which allows local users to bypass an intended read-only restriction and defeat certain sandbox protection mechanisms via a ""mount -o remount"" command within a user namespace.",http://github.com/torvalds/linux/commit/a6138db815df5ee542d848318e5dae681590fccd,2014-08-18T11:15Z
4374,2014,9566d6742852c527bf5af38af5cbb878dad75705,"fs/namespace.c in the Linux kernel through 3.16.1 does not properly restrict clearing MNT_NODEV, MNT_NOSUID, and MNT_NOEXEC and changing MNT_ATIME_MASK during a remount of a bind mount, which allows local users to gain privileges, interfere with backups and auditing on systems that had atime enabled, or cause a denial of service (excessive filesystem updating) on systems that had atime disabled via a ""mount -o remount"" command within a user namespace.",http://github.com/torvalds/linux/commit/9566d6742852c527bf5af38af5cbb878dad75705,2014-08-18T11:15Z
4414,2014,530af9cb8e700e7596b3ec812bad123c9fa06356,"Node.js 0.8 before 0.8.28 and 0.10 before 0.10.30 does not consider the possibility of recursive processing that triggers V8 garbage collection in conjunction with a V8 interrupt, which allows remote attackers to cause a denial of service (memory corruption and application crash) via deep JSON objects whose parsing lets this interrupt mask an overflow of the program stack.",http://github.com/joyent/node/commit/530af9cb8e700e7596b3ec812bad123c9fa06356,2014-09-05T17:55Z
4426,2014,bc1731dbb53850c380875ad683cd87c8ec99eee3,"Plack::App::File in Plack before 1.0031 removes trailing slash characters from paths, which allows remote attackers to bypass the whitelist of generated files and obtain sensitive information via a crafted path, related to Plack::Middleware::Static.",http://github.com/avar/Plack/commit/bc1731dbb53850c380875ad683cd87c8ec99eee3,2014-09-04T17:55Z
4430,2014,2c45d7caa614afd71dbe3d0f7270f51ce5569614,"Multiple cross-site scripting (XSS) vulnerabilities in phpMyAdmin 4.0.x before 4.0.10.2, 4.1.x before 4.1.14.3, and 4.2.x before 4.2.7.1 allow remote authenticated users to inject arbitrary web script or HTML via the (1) browse table page, related to js/sql.js; (2) ENUM editor page, related to js/functions.js; (3) monitor page, related to js/server_status_monitor.js; (4) query charts page, related to js/tbl_chart.js; or (5) table relations page, related to libraries/tbl_relation.lib.php.",http://github.com/phpmyadmin/phpmyadmin/commit/2c45d7caa614afd71dbe3d0f7270f51ce5569614,2014-08-22T01:55Z
4430,2014,3ffc967fb60cf2910cc2f571017e977558c67821,"Multiple cross-site scripting (XSS) vulnerabilities in phpMyAdmin 4.0.x before 4.0.10.2, 4.1.x before 4.1.14.3, and 4.2.x before 4.2.7.1 allow remote authenticated users to inject arbitrary web script or HTML via the (1) browse table page, related to js/sql.js; (2) ENUM editor page, related to js/functions.js; (3) monitor page, related to js/server_status_monitor.js; (4) query charts page, related to js/tbl_chart.js; or (5) table relations page, related to libraries/tbl_relation.lib.php.",http://github.com/phpmyadmin/phpmyadmin/commit/3ffc967fb60cf2910cc2f571017e977558c67821,2014-08-22T01:55Z
4430,2014,647c9d12e33a6b64e1c3ff7487f72696bdf2dccb,"Multiple cross-site scripting (XSS) vulnerabilities in phpMyAdmin 4.0.x before 4.0.10.2, 4.1.x before 4.1.14.3, and 4.2.x before 4.2.7.1 allow remote authenticated users to inject arbitrary web script or HTML via the (1) browse table page, related to js/sql.js; (2) ENUM editor page, related to js/functions.js; (3) monitor page, related to js/server_status_monitor.js; (4) query charts page, related to js/tbl_chart.js; or (5) table relations page, related to libraries/tbl_relation.lib.php.",http://github.com/phpmyadmin/phpmyadmin/commit/647c9d12e33a6b64e1c3ff7487f72696bdf2dccb,2014-08-22T01:55Z
4430,2014,90ddeecf60fc029608b972e490b735f3a65ed0cb,"Multiple cross-site scripting (XSS) vulnerabilities in phpMyAdmin 4.0.x before 4.0.10.2, 4.1.x before 4.1.14.3, and 4.2.x before 4.2.7.1 allow remote authenticated users to inject arbitrary web script or HTML via the (1) browse table page, related to js/sql.js; (2) ENUM editor page, related to js/functions.js; (3) monitor page, related to js/server_status_monitor.js; (4) query charts page, related to js/tbl_chart.js; or (5) table relations page, related to libraries/tbl_relation.lib.php.",http://github.com/phpmyadmin/phpmyadmin/commit/90ddeecf60fc029608b972e490b735f3a65ed0cb,2014-08-22T01:55Z
4430,2014,cd9f302bf7f91a160fe7080f9a612019ef847f1c,"Multiple cross-site scripting (XSS) vulnerabilities in phpMyAdmin 4.0.x before 4.0.10.2, 4.1.x before 4.1.14.3, and 4.2.x before 4.2.7.1 allow remote authenticated users to inject arbitrary web script or HTML via the (1) browse table page, related to js/sql.js; (2) ENUM editor page, related to js/functions.js; (3) monitor page, related to js/server_status_monitor.js; (4) query charts page, related to js/tbl_chart.js; or (5) table relations page, related to libraries/tbl_relation.lib.php.",http://github.com/phpmyadmin/phpmyadmin/commit/cd9f302bf7f91a160fe7080f9a612019ef847f1c,2014-08-22T01:55Z
4431,2014,0cd293f5e13aa245e4a57b8d373597cc0e421b6f,"Cross-site scripting (XSS) vulnerability in the view operations page in phpMyAdmin 4.1.x before 4.1.14.3 and 4.2.x before 4.2.7.1 allows remote authenticated users to inject arbitrary web script or HTML via a crafted view name, related to js/functions.js.",http://github.com/phpmyadmin/phpmyadmin/commit/0cd293f5e13aa245e4a57b8d373597cc0e421b6f,2014-08-22T01:55Z
4470,2014,b2d0e6f92310bb14a15aa2f8e96e1fb5379776dd,"Monkey HTTP Server before 1.5.3, when the File Descriptor Table (FDT) is enabled and custom error messages are set, allows remote attackers to cause a denial of service (file descriptor consumption) via an HTTP request that triggers an error message.",http://github.com/monkey/monkey/commit/b2d0e6f92310bb14a15aa2f8e96e1fb5379776dd,2014-08-26T14:55Z
4485,2014,af0ed4df4dfae762ab5fb605f5a0c8f59cb4f6ca,"The kadm5_randkey_principal_3 function in lib/kadm5/srv/svr_principal.c in kadmind in MIT Kerberos 5 (aka krb5) before 1.13 sends old keys in a response to a -randkey -keepold request, which allows remote authenticated users to forge tickets by leveraging administrative access.",http://github.com/krb5/krb5/commit/af0ed4df4dfae762ab5fb605f5a0c8f59cb4f6ca,2014-10-10T01:55Z
4486,2014,82dc33da50338ac84c7b4102dc6513d897d0506a,"The krb5_gss_process_context_token function in lib/gssapi/krb5/process_context_token.c in the libgssapi_krb5 library in MIT Kerberos 5 (aka krb5) through 1.11.5, 1.12.x through 1.12.2, and 1.13.x before 1.13.1 does not properly maintain security-context handles, which allows remote authenticated users to cause a denial of service (use-after-free and double free, and daemon crash) or possibly execute arbitrary code via crafted GSSAPI traffic, as demonstrated by traffic to kadmind.",http://github.com/krb5/krb5/commit/82dc33da50338ac84c7b4102dc6513d897d0506a,2015-02-19T11:59Z
4487,2014,d1f707024f1d0af6e54a18885322d70fa15ec4d3,"The krb5_ldap_get_password_policy_from_dn function in plugins/kdb/ldap/libkdb_ldap/ldap_pwd_policy.c in MIT Kerberos 5 (aka krb5) before 1.13.1, when the KDC uses LDAP, allows remote authenticated users to cause a denial of service (daemon crash) via a successful LDAP query with no results, as demonstrated by using an incorrect object type for a password policy.",http://github.com/krb5/krb5/commit/d1f707024f1d0af6e54a18885322d70fa15ec4d3,2014-12-16T23:59Z
4488,2014,04038bf3633c4b909b5ded3072dc88c8c419bf16,"plugins/kdb/ldap/libkdb_ldap/ldap_principal2.c in MIT Kerberos 5 (aka krb5) 1.12.x and 1.13.x before 1.13.1, when the KDC uses LDAP, allows remote authenticated users to cause a denial of service (NULL pointer dereference and daemon crash) by creating a database entry for a keyless principal, as demonstrated by a kadmin ""add_principal -nokey"" or ""purgekeys -all"" command.",http://github.com/krb5/krb5/commit/04038bf3633c4b909b5ded3072dc88c8c419bf16,2014-12-16T23:59Z
4489,2014,102bb6ebf20f9174130c85c3b052ae104e5073ec,"MIT Kerberos 5 (aka krb5) through 1.13.1 incorrectly expects that a krb5_read_message data field is represented as a string ending with a '\0' character, which allows remote attackers to (1) cause a denial of service (NULL pointer dereference) via a zero-byte version string or (2) cause a denial of service (out-of-bounds read) by omitting the '\0' character, related to appl/user_user/server.c and lib/krb5/krb/recvauth.c.",http://github.com/krb5/krb5/commit/102bb6ebf20f9174130c85c3b052ae104e5073ec,2015-02-20T11:59Z
4506,2014,ab6fdeb84fb090b48606b6f7933028cfe7bf3a5e,"The mcrypt_create_iv function in hphp/runtime/ext/mcrypt/ext_mcrypt.cpp in Facebook HipHop Virtual Machine (HHVM) before 3.3.0 does not seed the random number generator, which makes it easier for remote attackers to defeat cryptographic protection mechanisms by leveraging the use of a single initialization vector.",http://github.com/facebook/hhvm/commit/ab6fdeb84fb090b48606b6f7933028cfe7bf3a5e,2014-12-28T15:59Z
4560,2014,95464495f1e3e714d5c295fe621af5d2e0d4238d,"Multiple cross-site scripting (XSS) vulnerabilities in app/views/layouts/application.html.haml in Fat Free CRM before 0.13.3 allow remote attackers to inject arbitrary web script or HTML via the (1) username, (2) first name, or (3) last name in a (a) create or (b) edit user action.",http://github.com/fatfreecrm/fat_free_crm/commit/95464495f1e3e714d5c295fe621af5d2e0d4238d,2014-09-12T14:55Z
4569,2014,e36f80f18e9514204bf2ce82747c8adf7e47a9c9,"Cross-site scripting (XSS) vulnerability in manager/templates/default/header.tpl in MODX Revolution 2.3.1-pl and earlier allows remote attackers to inject arbitrary web script or HTML via the ""a"" parameter to manager/.  NOTE: this issue exists because of a CVE-2014-2080 regression.",http://github.com/modxcms/revolution/commit/e36f80f18e9514204bf2ce82747c8adf7e47a9c9,2014-11-06T18:55Z
4584,2014,410dd3cf4c9b36f27ed4542ee18b1af5e68645a4,"Stack consumption vulnerability in the parse_rock_ridge_inode_internal function in fs/isofs/rock.c in the Linux kernel through 3.16.1 allows local users to cause a denial of service (uncontrolled recursion, and system crash or reboot) via a crafted iso9660 image with a CL entry referring to a directory entry that has a CL entry.",http://github.com/torvalds/linux/commit/410dd3cf4c9b36f27ed4542ee18b1af5e68645a4,2014-09-01T01:55Z
4585,2014,410dd3cf4c9b36f27ed4542ee18b1af5e68645a4,The parse_rock_ridge_inode_internal function in fs/isofs/rock.c in the Linux kernel through 3.16.1 allows local users to cause a denial of service (unkillable mount process) via a crafted iso9660 image with a self-referential CL entry.,http://github.com/torvalds/linux/commit/410dd3cf4c9b36f27ed4542ee18b1af5e68645a4,2014-09-01T01:55Z
5123,2014,045a044e8ae79db9244593fbce154cdf6e843273,"Integer overflow in the MallocFrameBuffer function in vncviewer.c in LibVNCServer 0.9.9 and earlier allows remote VNC servers to cause a denial of service (crash) and possibly execute arbitrary code via an advertisement for a large screen size, which triggers a heap-based buffer overflow.",http://github.com/newsoft/libvncserver/commit/045a044e8ae79db9244593fbce154cdf6e843273,2014-09-30T16:55Z
5124,2014,85a778c0e45e87e35ee7199f1f25020648e8b812,"The HandleRFBServerMessage function in libvncclient/rfbproto.c in LibVNCServer 0.9.9 and earlier does not check certain malloc return values, which allows remote VNC servers to cause a denial of service (application crash) or possibly execute arbitrary code by specifying a large screen size in a (1) FramebufferUpdate, (2) ResizeFrameBuffer, or (3) PalmVNCReSizeFrameBuffer message.",http://github.com/newsoft/libvncserver/commit/85a778c0e45e87e35ee7199f1f25020648e8b812,2014-12-15T18:59Z
5125,2014,6037a9074d52b1963c97cb28ea1096c7c14cbf28,"The rfbProcessClientNormalMessage function in libvncserver/rfbserver.c in LibVNCServer 0.9.9 and earlier does not properly handle attempts to send a large amount of ClientCutText data, which allows remote attackers to cause a denial of service (memory consumption or daemon crash) via a crafted message that is processed by using a single unchecked malloc.",http://github.com/newsoft/libvncserver/commit/6037a9074d52b1963c97cb28ea1096c7c14cbf28,2014-12-15T18:59Z
5126,2014,05a9bd41a8ec0a9d580a8f420f41718bdd235446,The rfbProcessClientNormalMessage function in libvncserver/rfbserver.c in LibVNCServer 0.9.9 and earlier allows remote attackers to cause a denial of service (divide-by-zero error and server crash) via a zero value in the scaling factor in a (1) PalmVNCSetScaleFactor or (2) SetScale message.,http://github.com/newsoft/libvncserver/commit/05a9bd41a8ec0a9d580a8f420f41718bdd235446,2014-10-06T14:55Z
5127,2014,06ccdf016154fde8eccb5355613ba04c59127b2e,Multiple stack-based buffer overflows in the File Transfer feature in rfbserver.c in LibVNCServer 0.9.9 and earlier allow remote authenticated users to cause a denial of service (crash) and possibly execute arbitrary code via a (1) long file or (2) directory name or the (3) FileTime attribute in a rfbFileTransferOffer message.,http://github.com/newsoft/libvncserver/commit/06ccdf016154fde8eccb5355613ba04c59127b2e,2014-09-30T16:55Z
5127,2014,f528072216dec01cee7ca35d94e171a3b909e677,Multiple stack-based buffer overflows in the File Transfer feature in rfbserver.c in LibVNCServer 0.9.9 and earlier allow remote authenticated users to cause a denial of service (crash) and possibly execute arbitrary code via a (1) long file or (2) directory name or the (3) FileTime attribute in a rfbFileTransferOffer message.,http://github.com/newsoft/libvncserver/commit/f528072216dec01cee7ca35d94e171a3b909e677,2014-09-30T16:55Z
5251,2014,1f91e076a585118495b976a413c1df40f6fd3d41,Integer overflow in the string_chunk_split function in hphp/runtime/base/zend-string.cpp in Facebook HipHop Virtual Machine (HHVM) before 3.3.0 allows remote attackers to cause a denial of service (application crash) or possibly have unspecified other impact via crafted arguments to the chunk_split function.,http://github.com/facebook/hhvm/commit/1f91e076a585118495b976a413c1df40f6fd3d41,2014-12-28T15:59Z
5252,2014,7135ec229882370a00411aa50030eada6034cc1b,"The HashContext class in hphp/runtime/ext/ext_hash.cpp in Facebook HipHop Virtual Machine (HHVM) before 3.3.0 incorrectly expects that a certain key string uses '\0' for termination, which allows remote attackers to obtain sensitive information by leveraging read access beyond the end of the string, and makes it easier for remote attackers to defeat cryptographic protection mechanisms by leveraging truncation of a string containing an internal '\0' character.",http://github.com/facebook/hhvm/commit/7135ec229882370a00411aa50030eada6034cc1b,2014-12-28T15:59Z
5288,2014,c163bf5910d0d36424d7fc678da6b03a0e443435,Multiple cross-site scripting (XSS) vulnerabilities in OSClass before 3.4.2 allow remote attackers to inject arbitrary web script or HTML via the (1) action or (2) nsextt parameter to oc-admin/index.php or the (3) nsextt parameter in an items_reported action to oc-admin/index.php.,http://github.com/osclass/Osclass/commit/c163bf5910d0d36424d7fc678da6b03a0e443435,2014-10-20T14:55Z
5304,2014,33b39f9f1dd9a4d27856530e5ac004e23b30e8ac,"Cross-site scripting (XSS) vulnerability in the micro history implementation in phpMyAdmin 4.0.x before 4.0.10.3, 4.1.x before 4.1.14.4, and 4.2.x before 4.2.8.1 allows remote attackers to inject arbitrary web script or HTML, and consequently conduct a cross-site request forgery (CSRF) attack to create a root account, via a crafted URL, related to js/ajax.js.",http://github.com/phpmyadmin/phpmyadmin/commit/33b39f9f1dd9a4d27856530e5ac004e23b30e8ac,2014-11-08T11:55Z
5309,2014,c163bf5910d0d36424d7fc678da6b03a0e443435,Directory traversal vulnerability in OSClass before 3.4.2 allows remote attackers to read arbitrary files via a .. (dot dot) in the file parameter in a render action to oc-admin/index.php.,http://github.com/osclass/Osclass/commit/c163bf5910d0d36424d7fc678da6b03a0e443435,2014-10-20T14:55Z
5314,2014,e66ecc9f,"core/string_api.php in MantisBT before 1.2.18 does not properly categorize URLs when running under the web root, which allows remote attackers to conduct open redirect and phishing attacks via a crafted URL in the return parameter to login_page.php.",http://github.com/mantisbt/mantisbt/commit/e66ecc9f,2014-12-12T11:59Z
5390,2014,9c6ca9b2c0b880afd3ff91ce0d211213c5fa5f9a,"visionmedia send before 0.8.4 for Node.js uses a partial comparison for verifying whether a directory is within the document root, which allows remote attackers to access restricted directories, as demonstrated using ""public-restricted"" under a ""public"" directory.",http://github.com/visionmedia/send/commit/9c6ca9b2c0b880afd3ff91ce0d211213c5fa5f9a,2014-10-08T17:55Z
5391,2014,e3abe7d7585ecc420a7cab73313216613aadad5a,Heap-based buffer overflow in the dissector_postgresql function in dissectors/ec_postgresql.c in Ettercap before 0.8.1 allows remote attackers to cause a denial of service or possibly execute arbitrary code via a crafted password length value that is inconsistent with the actual length of the password.,http://github.com/Ettercap/ettercap/commit/e3abe7d7585ecc420a7cab73313216613aadad5a,2014-12-19T15:59Z
5392,2014,e3abe7d7585ecc420a7cab73313216613aadad5a,"The dissector_postgresql function in dissectors/ec_postgresql.c in Ettercap before 0.8.1 allows remote attackers to cause a denial of service and possibly execute arbitrary code via a crafted password length, which triggers a 0 character to be written to an arbitrary memory location.",http://github.com/Ettercap/ettercap/commit/e3abe7d7585ecc420a7cab73313216613aadad5a,2014-12-19T15:59Z
5396,2014,c03aa9f6e1f938618e6db2e23afef0574efeeb65,"The __udf_read_inode function in fs/udf/inode.c in the Linux kernel through 3.16.3 does not restrict the amount of ICB indirection, which allows physically proximate attackers to cause a denial of service (infinite loop or stack consumption) via a UDF filesystem with a crafted inode.",http://github.com/torvalds/linux/commit/c03aa9f6e1f938618e6db2e23afef0574efeeb65,2014-09-28T10:55Z
5399,2014,c27a3e4d667fdcad3db7b104f75659478e0c68d8,"Buffer overflow in net/ceph/auth_x.c in Ceph, as used in the Linux kernel before 3.16.3, allows remote attackers to cause a denial of service (memory corruption and panic) or possibly have unspecified other impact via a long unencrypted auth ticket.",http://github.com/torvalds/linux/commit/c27a3e4d667fdcad3db7b104f75659478e0c68d8,2014-09-28T10:55Z
5400,2014,c27a3e4d667fdcad3db7b104f75659478e0c68d8,"net/ceph/auth_x.c in Ceph, as used in the Linux kernel before 3.16.3, does not properly consider the possibility of kmalloc failure, which allows remote attackers to cause a denial of service (system crash) or possibly have unspecified other impact via a long unencrypted auth ticket.",http://github.com/torvalds/linux/commit/c27a3e4d667fdcad3db7b104f75659478e0c68d8,2014-09-28T10:55Z
5401,2014,c27a3e4d667fdcad3db7b104f75659478e0c68d8,"net/ceph/auth_x.c in Ceph, as used in the Linux kernel before 3.16.3, does not properly validate auth replies, which allows remote attackers to cause a denial of service (system crash) or possibly have unspecified other impact via crafted data from the IP address of a Ceph Monitor.",http://github.com/torvalds/linux/commit/c27a3e4d667fdcad3db7b104f75659478e0c68d8,2014-09-28T10:55Z
6104,2014,a701ceeb410bdda9d96c9d3d12104630df5d5b43,Cross-site scripting (XSS) vulnerability in the Google Calendar Events plugin before 2.0.4 for WordPress allows remote attackers to inject arbitrary web script or HTML via the gce_feed_ids parameter in a gce_ajax action to wp-admin/admin-ajax.php.,http://github.com/pderksen/WP-Google-Calendar-Events/commit/a701ceeb410bdda9d96c9d3d12104630df5d5b43,2014-10-16T19:55Z
6110,2014,18f39e7be0121317550d03e267e3ebd4dbfbb3ce,The SMB2_tcon function in fs/cifs/smb2pdu.c in the Linux kernel before 3.16.3 allows remote CIFS servers to cause a denial of service (NULL pointer dereference and client system crash) or possibly have unspecified other impact by deleting the IPC$ share during resolution of DFS referrals.,http://github.com/torvalds/linux/commit/18f39e7be0121317550d03e267e3ebd4dbfbb3ce,2014-09-28T10:55Z
6111,2014,84017535,"The XmlImportExport plugin in MantisBT 1.2.17 and earlier allows remote attackers to execute arbitrary PHP code via a crafted (1) description field or (2) issuelink attribute in an XML file, which is not properly handled when executing the preg_replace function with the e modifier.",http://github.com/mantisbt/mantisbt/commit/84017535,2014-11-18T15:59Z
6111,2014,bed19db9,"The XmlImportExport plugin in MantisBT 1.2.17 and earlier allows remote attackers to execute arbitrary PHP code via a crafted (1) description field or (2) issuelink attribute in an XML file, which is not properly handled when executing the preg_replace function with the e modifier.",http://github.com/mantisbt/mantisbt/commit/bed19db9,2014-11-18T15:59Z
